"audio_loudness","obs","audio_filename","audio_legend","type","voice_tone","desired_lufs"
"Medio.",,"A1_M2702_ELL_9965","Eu precisava te proteger. Não se preocupe... Não se preocupe comigo. Tenho certeza de que vou te ver em breve.","Gravação de áudio","Normal",
"Medio.",,"A1_M2702_ELL_1310","Eu te amo, meu amor.","Gravação de áudio","Normal",
"Baixo.",,"A1_M2702_RIP_7513","Meu Deus.","Fala instrospectiva","Normal",
"Medio.",,"A1_M2702_MAR_8825","Agora você entendeu.","Dialogo","Normal",
"Medio.",,"A1_M2702_MAR_9269","Eu vou sobrecarregar o reator de fusão.","Dialogo","Normal",
"Medio.",,"A1_M2702_RIP_1473","Isso vai transformar o reator em uma maldita arma nuclear. Você vai destruir a nave! E a estação!","Dialogo","Normal",
"Medio.",,"A1_M2702_MAR_8397","Vai aniquilar qualquer rastro daquela criatura. Ripley, é o único jeito. Não posso deixar ele viver. E eu não vou deixar a Companhia ficar com ele ou eles vão começar tudo isso de novo.","Dialogo","Normal",
"Medio.",,"A1_G0000_RIP_0250E","Me escutem!","Dialogo","Normal",
"Medio.",,"A1_G0000_RIP_0250A","Me escutem!","Dialogo","Normal",
"Medio.",,"A1_M2702_TAY_2383","Pare! Pare com isso, Marlow!","Dialogo","Normal",
"Baixo.",,"A1_M2702_RIP_3430","Marlow... por favor...","Dialogo","Normal",
"Medio.",,"A1_M2702_MAR_9235","Você ouviu o que a sua mãe fez. Ela entendeu. Se ela estivesse aqui, estaria me ajudando.","Dialogo","Normal",
"Medio.",,"A1_M2702_MAR_3087","Acha que ela ia querer que os executivos da Companhia soubessem o endereço dessa criatura? Ninguém deve saber.","Dialogo","Normal",
"Medio.",,"A1_M2702_TAY_5538","Ainda tem gente viva na estação! Marlow!","Dialogo","Normal",
"Medio.",,"A1_M2702_MAR_1218","Mas não a Foster. Ela era minha esposa. Eu a amava e a matei.","Dialogo","Normal",
"Medio.",,"A1_M2702_TAY_6485","Oh, meu Deus. Acho que cheguei tarde demais. Ele já ativou. Ele já ativou!","Dialogo","Normal",
"Baixo.",,"A1_M2702_RIP_3405","Taylor! Eu vou deter a sobrecarga! Você tem que me ajudar! Vá até aquele console!","Dialogo","Normal",
"Medio.",,"A1_M2702_TOR_4522","Alerta. Sobrecarga do Reator de Fusão em andamento.","Efeito sonoro","Normal",
"Baixo.",,"A1_M2702_RIP_7391","Abra os sistemas de fusão pra eu poder trabalhar neles!","Dialogo","Normal",
"Medio.",,"A1_M2702_TAY_9674","O quê?","Dialogo","Normal",
"Baixo.",,"A1_M2702_RIP_3886","Eu preciso de energia no gerador auxiliar. Procure as letras AUX.","Dialogo","Normal",
"Medio.",,"A1_M2702_TAY_3555","Encontrei!","Dialogo","Normal",
"Baixo.",,"A1_M2702_RIP_6056","Certo. Você tá indo bem, Taylor.","Dialogo","Normal",
"Baixo.",,"A1_M2702_RIP_7270","Agora mude o terminal de manutenção de ""automático"" pra ""manual"". Consegue ver?","Dialogo","Normal",
"Medio.",,"A1_M2702_TAY_4957","Eu - eu não consigo achar!","Dialogo","Normal",
"Baixo.",,"A1_M2702_RIP_7570","Tá aí, Taylor, confie em mim!","Dialogo","Normal",
"Baixo.",,"A1_M2702_RIP_7322","É isso!","Dialogo","Normal",
"Medio.",,"A1_M2702_TOR_6514","Sobrecarga do Reator de Fusão anulada\nLimitadores de segurança restaurados","Efeito sonoro","Normal",
"Medio.",,"A1_M2702_TAY_7973","Oh, Deus. Você conseguiu.","Dialogo","Normal",
"Baixo.",,"A1_M2702_TAY_9699","Espere. Está acontecendo alguma coisa. Eu não entendo...","Dialogo","Normal",
"Baixo.",,"A1_M2702_TAY_8107","""Queda dos sistemas primários. Falha em cascata em todo o sistema...""","Dialogo","Normal",
"Baixo.",,"A1_M2702_RIP_3750","Ah, merda! O Marlow forçou uma sobrecarga... a nave vai se despedaçar!","Dialogo","Normal",
"Medio.",,"A1_M2702_TOR_4950","Alerta. Queda crítica. Alerta. Queda crítica.","Efeito sonoro","Normal",
"Baixo.",,"A1_M3001_RIP_2946","Ricardo? Ricardo?","Dialogo","Normal",
"Baixo.",,"A1_M3001_RIC_3951","Ripley, a explosão da Anesidora derrubou os estabilizadores orbitais. Estamos prestes a cair.","Walk Talk","Normal",
"Baixo.",,"A1_M3001_RIC_8549","Eu estou tentando contatar a Torrens, mas a comunicação ainda tá bloqueada. A ambulância que você acoplou tá destruída. A Torrens é a nossa única chance de sair.","Walk Talk","Normal",
"Baixo.",,"A1_M3001_RIC_5572","A transmissão de Verlaine foi atualizada.","Walk Talk","Normal",
"Baixo.",,"A1_M3001_VER_2780","Alô, Sevastopol? Podem responder? Nós acabamos de ver uma nave explodir a seu estibordo. A explosão destruiu uma estrutura inteira de estabilizadores orbitais. Não temos lugar para acoplar. Por favor, diga o que está acontecendo. Podemos levar sobreviventes. Vou deixar esse canal aberto. Torrens desligando.","Walk Talk","Normal",
"Baixo.",,"AI_UI_LAM_0010","Aqui é Lambert confirmando o atraso da coleta da refinaria que estamos levando de volta para a Terra. Inseri as coordenadas iniciais para a borda de Epsilon Reticuli usando a rota estabelecida de transporte. Minha próxima entrada será a confirmação do nosso plano de voo para o Sistema Solar. Lambert desligando.","Gravação de áudio","Normal",
"Baixo.",,"AI_UI_LAM_0020","Aqui é Lambert, navegadora da USCSS Nostromo, registrando que todos os sinais de navegação e coordenadas do Sistema Solar foram verificadas pela MÃE. O controle de Tráfego Antarctica vai receber nossa chamada no dia 22 de outubro ou algumas horas de diferença. Desligando.","Gravação de áudio","Normal",
"Baixo.",,"AI_UI_BRE_0010","Certo. Terminando aqui. Kane me perguntou se podíamos dar um jeito de acionar o aquecedor antes de a gente sair das geladeiras. Parker disse que sem chance, não é nossa função. Da próxima vez eles vão pedir toalhas com suas iniciais e uma massagem. Então, não fizemos isso e os avisamos. Brett, câmbio e desligo.","Gravação de áudio","Normal",
"Baixo.",,"AI_UI_WAI_3331","Dr.Morley, aqui é o Delegado Federal Waits. Certifique-se de que seus pacientes estejam preparados para a desativação. Isso significa documentação completa, pertences pessoais e qualquer medicamento que precisem durante a viagem. Estou programando mensageiros para transferi-los à nave médica para transporte. Recomendo que coloque os pacientes mais instáveis em hibernação antes do transporte. Não quero ouvir suas reclamações. Não tenho pessoal suficiente para garantir a proteção de todos, caso algum deles decida dar chilique. Remédios ou hibernação, não importa. Só os faça ficarem calmos. E é assim que tem que ser. Waits desligando.","Gravação de áudio","Normal",
"Baixo.",,"AI_UI_PAR_0020","Estamos em direção à borda do sistema. Ripley me deu uma lista do que é preciso fazer, diz que a MÃE não vai nos deixar acelerar até que consertemos a unidade secundária de carga. Muito trabalho para um voo de rotina. Dallas, se você encontrou tempo na sua agenda para ouvir isso, Brett e eu estamos trabalhando em dobro. Se você não aparecer com um bônus, nós vamos reclamar com o sindicato.","Gravação de áudio","Normal",
