soundbank_name,internal_audio_name,audio_name,type,voice_tone,perception_loudness,desired_lufs,audio_legend,obs
PORTUGUESE(BRAZIL)_DIALOGUE.PCK,File3696-broken.wem,A1_M1602_RIC_7596,Walk Talk,Normal,Medio.,,Tenha cuidado.,
PORTUGUESE(BRAZIL)_DIALOGUE.PCK,File0497-broken.wem,AI_UI_JUL_2629,Gravação de áudio,Normal,Medio.,,"(Limpa a garganta)Eu.. Eu não sei quando alguém receberá isso, mas alguém precisa registrar e eu não sei... (limpa a garganta de novo). Eu cheguei aqui há alguns meses pra escrever sobre o colapso de um sonho, um futuro arruinado. Pra mim, as pessoas daqui eram pouco mais que notas de rodapé para o meu artigo, algo pra manipular emoções. (com sarcasmo) E quando começaram os desaparecimentos, oh, eu fiquei entusiasmada. Isso era algo grande. Mas agora, as pessoas estão com medo e um defeito nas comunicações nos deixou sozinhos. Eu estou presa aqui, como todos os outros. Mais uma nota de rodapé. Mais uma vítima.",
PORTUGUESE(BRAZIL)_DIALOGUE.PCK,File2464.wem,A1_M1602_RIP_7561,Dialogo,Sussurro,Baixo.,,Waits? É a Ripley. O que está acontecendo com os androides?,
PORTUGUESE(BRAZIL)_DIALOGUE.PCK,File4541-broken.wem,A1_M1602_WAI_5809,Walk Talk,Normal,Medio.,,Não sei.,
PORTUGUESE(BRAZIL)_DIALOGUE.PCK,File5490-broken.wem,A1_M1602_RIP_7070,Dialogo,Sussurro,Baixo.,,E a mudança do status do alerta?,
PORTUGUESE(BRAZIL)_DIALOGUE.PCK,File4391-broken.wem,A1_M1602_WAI_7965,Walk Talk,Normal,Medio.,,"Droga, eu não sei! Estou tentando entrar em contato com Samuels. Talvez ele saiba o que o APOLLO está fazendo.",
PORTUGUESE(BRAZIL)_DIALOGUE.PCK,File0521.wem,A1_M1602_RIP_6271,Dialogo,Sussurro,Baixo.,,Waits. Pelo amor de Deus. O APOLLO liberou os androides. Eles atacam quem estiver na frente.,
PORTUGUESE(BRAZIL)_DIALOGUE.PCK,File3556.wem,A1_M1602_WAI_4178,Walk Talk,Normal,Medio.,,Eu não sei o que é isso. Eles não estão respondendo às violações de invasão. Parece que estão... caçando.,
PORTUGUESE(BRAZIL)_DIALOGUE.PCK,File5179.wem,A1_M1602_RIP_7033,Dialogo,Sussurro,Baixo.,,Caçando quem?,
PORTUGUESE(BRAZIL)_DIALOGUE.PCK,File2649-broken.wem,A1_M1602_RIP_5802,Dialogo,Sussurro,Baixo.,,Caçando quem?,
PORTUGUESE(BRAZIL)_DIALOGUE.PCK,File1035-broken.wem,A1_M1602_WAI_5430,Walk Talk,Normal,Medio.,,Tudo e todos.,
PORTUGUESE(BRAZIL)_DIALOGUE.PCK,File2664.wem,A1_M1602_RIP_9038,Dialogo,Sussurro,Baixo.,,O que está dizendo?,
PORTUGUESE(BRAZIL)_DIALOGUE.PCK,File2591-broken.wem,A1_M1602_WAI_5751,Walk Talk,Normal,Medio.,,Espere.,
PORTUGUESE(BRAZIL)_DIALOGUE.PCK,File4270.wem,A1_M1602_RIP_8184,Dialogo,Sussurro,Baixo.,,Waits? Tem umas portas corrediças na minha frente. Você pode abrí-las? Waits?,
PORTUGUESE(BRAZIL)_DIALOGUE.PCK,File6427.wem,A1_M1602_WAI_4605,Walk Talk,Normal,Medio.,,Seus cornos! Seus cornos assassinos! Deixem eles em paz! Recuem!,
PORTUGUESE(BRAZIL)_DIALOGUE.PCK,File2365.wem,A1_M1602_WAI_7419,Walk Talk,Normal,Medio.,,seus desgraçados... (mais barulhos horríveis e um grito terrível e transtornado dele ao morrer),
PORTUGUESE(BRAZIL)_DIALOGUE.PCK,File3636-broken.wem,A1_M1602_RIP_5873,Dialogo,Sussurro,Baixo.,,Waits? Waits?,
PORTUGUESE(BRAZIL)_DIALOGUE.PCK,File3183.wem,AI_UI_HEY_5831,Gravação de áudio,Normal,Medio.,,"Meeks, estou deixando isso pra quando acordar. Eu sei que você ainda está meio assim depois que aquela coisa saiu da Foster, mas você tem que parar de estragar as coisas. Você passou da conta na bebedeira e contou mais do que deveria para as pessoas que estão dormindo no Shopping. Eu arrastei você pra longe quando vi o olhar deles. Não podemos mais voltar lá. Ninguém pode saber que temos conexões com Marlow e a Anesidora. Eu volto depois que você ficar sóbrio.",
PORTUGUESE(BRAZIL)_DIALOGUE.PCK,File4818.wem,AI_UI_WIN_1256,Gravação de áudio,Normal,Medio.,,"Fiquei acampada no shopping Galleria por umas vinte e quatro horas. As pessoas aqui estão assustadas, mas ainda acreditam que o Delegado Waits vai matar a criatura. Eles se esquecem de outros perigos. Eles se esquecem de si mesmos. As pessoas se viram uma contra as outras por comida, água. Não posso ficar aqui.",
PORTUGUESE(BRAZIL)_DIALOGUE.PCK,File0810.wem,A1_M1602_RIC_2442,Dialogo,Normal,Medio.,,"Rip. Rip, estão todos mortos.",
PORTUGUESE(BRAZIL)_DIALOGUE.PCK,File0478-broken.wem,A1_M1602_RIP_5490,Dialogo,Normal,Medio.,,Os androides os massacraram.,
PORTUGUESE(BRAZIL)_DIALOGUE.PCK,File5651-broken.wem,A1_M1602_RIC_4430,Dialogo,Normal,Medio.,,Por quê? Por que porra...,
PORTUGUESE(BRAZIL)_DIALOGUE.PCK,File0148.wem,A1_M1602_RIP_7548,Dialogo,Normal,Medio.,,Eu não sei. Mas acho que Samuels sabe.,
PORTUGUESE(BRAZIL)_DIALOGUE.PCK,File4100-broken.wem,A1_M1602_RIC_6817,Dialogo,Normal,Medio.,,Samuels? Por quê?,
PORTUGUESE(BRAZIL)_DIALOGUE.PCK,File4406.wem,A1_M1602_RIP_2826,Dialogo,Normal,Medio.,,Waits mandou ele acessar o APOLLO. Preciso encontrá-lo.,
PORTUGUESE(BRAZIL)_DIALOGUE.PCK,File5859-broken.wem,A1_M1602_RIP_7620,Dialogo,Normal,Medio.,,Você viu Taylor ou Marlow?,
PORTUGUESE(BRAZIL)_DIALOGUE.PCK,File4373-broken.wem,A1_M1602_RIC_1289,Dialogo,Normal,Medio.,,N-não.. Não,
PORTUGUESE(BRAZIL)_DIALOGUE.PCK,File0457-broken.wem,A1_M1602_RIP_2489,Dialogo,Normal,Medio.,,Eles não tão aqui. Acho que podem ter escapado. Ricardo? Ricardo!,
PORTUGUESE(BRAZIL)_DIALOGUE.PCK,File3706.wem,A1_M1602_RIP_5148,Dialogo,Normal,Medio.,,"Se eu for atrás do Samuels, você pode cuidar desse lugar? Preciso de olhos e ouvidos.",
PORTUGUESE(BRAZIL)_DIALOGUE.PCK,File5708.wem,A1_M1602_RIC_3745,Dialogo,Normal,Medio.,,Eu não vou ficar aqui nem ferrando.,
PORTUGUESE(BRAZIL)_DIALOGUE.PCK,File1411-broken.wem,A1_M1602_RIP_9669,Dialogo,Normal,Medio.,,"Ricardo, preciso que faça isso. Você pode operar a estação e me manter informada?\n(pausa)\nRicardo?",
PORTUGUESE(BRAZIL)_DIALOGUE.PCK,File6050.wem,A1_M1602_RIC_6440,Dialogo,Normal,Medio.,,"Sim, claro. Com certeza.",
PORTUGUESE(BRAZIL)_DIALOGUE.PCK,File6463.wem,A1_M1602_RIP_3442,Dialogo,Normal,Medio.,,Aguenta firme. Feche as portas e não deixe ninguém entrar. Cuide de mim. Vou voltar pra te buscar.,
PORTUGUESE(BRAZIL)_DIALOGUE.PCK,File5395-broken.wem,A1_M2101_RIP_6978,Dialogo,Normal,Medio.,,Claro.,
PORTUGUESE(BRAZIL)_DIALOGUE.PCK,File3738-broken.wem,A1_M2101_RIC_5838,Dialogo,Normal,Medio.,,"Vejo atividade nos terminais dos níveis superiores dos Sintéticos Seegson. (pausa) Rip, eu não sei se consigo fazer isso.",
PORTUGUESE(BRAZIL)_DIALOGUE.PCK,File0320.wem,A1_M2101_RIP_3471,Dialogo,Normal,Medio.,,"Ricardo, preciso que se concentre. Você está no comando, agora.",
PORTUGUESE(BRAZIL)_DIALOGUE.PCK,File4688-broken.wem,A1_M2101_RIC_7918,Dialogo,Normal,Medio.,,No comando? No comando de quê? De uma sala cheia de cadáveres? Tá tudo ferrado.,
PORTUGUESE(BRAZIL)_DIALOGUE.PCK,File5602-broken.wem,A1_M2101_RIP_1978,Dialogo,Normal,Medio.,,"Foco, Ricardo! Se o Samuels conseguir falar com o APOLLO, ele pode parar os androides. E tudo isso acaba.",
PORTUGUESE(BRAZIL)_DIALOGUE.PCK,File0576-broken.wem,AI_UI_PAR_0010,Gravação de áudio,Normal,Medio.,,"Ripley me pediu pra registrar um relatório sobre o que aconteceu com o cabo umbilical quando nós conectamos com a refinaria. Vou dizer o que aconteceu: eu e Brett,  estamos segurando este lugar com as próprias mãos. Você imaginaria que milhões de toneladas de minérios fossem o bastante para trazer alguém do convés superior, alguém que vai receber uma participação, aqui com a gente. Apenas para conferir o que precisamos. Você quer sair do sistema dentro do prazo da próxima vez? Coloque a Nostromo em doca seca por um mês, espere até que a gente termine o serviço e pague o que nos é devido. Parker desligando.",
PORTUGUESE(BRAZIL)_DIALOGUE.PCK,File2478-broken.wem,A1_M2101_RIP_3801,Dialogo,Normal,Medio.,,"Então, como eu subo?",
PORTUGUESE(BRAZIL)_DIALOGUE.PCK,File4167-broken.wem,A1_M2102_RIP_3161,Dialogo,Sussurro,Medio.,,Ricardo?,
PORTUGUESE(BRAZIL)_DIALOGUE.PCK,File1422.wem,A1_M2102_RIP_0955,Dialogo,Sussurro,Medio.,,Tó aqui. Parece o lugar onde os sintéticos vão para morrer.,
PORTUGUESE(BRAZIL)_DIALOGUE.PCK,File5192.wem,A1_M2102_RIP_0030,Fala instrospectiva,Sussurro,Medio.,,A porta aqui tá destruída. Não consigo chegar perto.,
PORTUGUESE(BRAZIL)_DIALOGUE.PCK,File1082.wem,AI_UI_RAN_7496,Gravação de áudio,Normal,Medio.,,"Aqui é o Executivo da Seegson Ransome falando. Eu acordei e encontrei um trabalhador sintético na minha suíte. Quando perguntei que diabos estava fazendo, ele avançou. Tive que sair do meu próprio apartamento! Mande seus melhores técnicos para o Núcleo do APOLLO e descubra que diabos está acontecendo agora! Quero essas coisas sob controle e quero um relatório completo o mais rápido possível.",
PORTUGUESE(BRAZIL)_DIALOGUE.PCK,File2555-broken.wem,A1_M2102_SAM_0965,Dialogo,Normal,Medio.,,Eu preciso ter acesso ao APOLLO. Abra o transporte da torre imediatamente.,
PORTUGUESE(BRAZIL)_DIALOGUE.PCK,File2496.wem,A1_M2102_SAM_0080,Dialogo,Normal,Medio.,,Não tenho tempo para isso.,
PORTUGUESE(BRAZIL)_DIALOGUE.PCK,File4713.wem,A1_M2102_RIP_1846,Fala instrospectiva,Normal,Baixo.,,Com defeito. Ótimo.,
PORTUGUESE(BRAZIL)_DIALOGUE.PCK,File2894.wem,A1_M2102_RIP_3092,Dialogo,Normal,Baixo.,,Nada. Só mais tranqueiras ferrando tudo nessa estação. Nada anormal.,
PORTUGUESE(BRAZIL)_DIALOGUE.PCK,File0156.wem,AI_UI_SPE_2855,Gravação de áudio,Normal,Medio.,,"Aqui é Spedding no Processamento de Androides. Temos uma situação, há vítimas de violência entre androides e humanos na estação. Um androide deu entrada no CTPA com trauma na cabeça, mas ele está coberto de sangue. Sangue humano. Eu alertei os Federais, coloquei a minha secretária em um lugar seguro e agora estou indo para o transporte. Vou pedir para um androide trabalhador consultar o APOLLO. Talvez ele saiba de quem é a culpa disto.",
PORTUGUESE(BRAZIL)_DIALOGUE.PCK,File0988.wem,A1_M2102_RIP_7330,Dialogo,Normal,Medio.,,Samuels! Não faça isso!,
PORTUGUESE(BRAZIL)_DIALOGUE.PCK,File1587-broken.wem,A1_M2102_SAM_7237,Dialogo,Normal,Medio.,,"APOLLO, a infecção foi contida. A criatura não está mais a bordo. A estação está segura. Solicito que todas as operações de Contenção de Risco sejam suspensas.",
PORTUGUESE(BRAZIL)_DIALOGUE.PCK,File5514.wem,A1_M2102_SGM_9224,Efeito sonoro,Normal,Medio.,,Alerta: Conexão não autorizada.,
PORTUGUESE(BRAZIL)_DIALOGUE.PCK,File3152-broken.wem,A1_M2102_SAM_5322,Dialogo,Normal,Medio.,,"Ripley, o APOLLO está me rejeitando. Acho que temos problemas.",
PORTUGUESE(BRAZIL)_DIALOGUE.PCK,File6171-broken.wem,A1_M2102_RIP_2115,Dialogo,Normal,Medio.,,Samuels?,
PORTUGUESE(BRAZIL)_DIALOGUE.PCK,File0828-broken.wem,A1_M2102_SAM_5714,Dialogo,Normal,Medio.,,"O APOLLO está tentando impedir a minha interação! [pausa] Oh, não, Amanda! Você precisa desconectar os sistemas manualmente! Por favor!",
PORTUGUESE(BRAZIL)_DIALOGUE.PCK,File1654-broken.wem,A1_M2102_RIP_2661,Dialogo,Normal,Medio.,,Jesus! Samuels! Eu vou tentar!,
PORTUGUESE(BRAZIL)_DIALOGUE.PCK,File6023-broken.wem,A1_M2102_SAM_4902,Dialogo,Normal,Medio.,,"ESPERE! Você precisa fazer isso na ordem correta ou o efeito cascata será fatal para mim. Estou acessando os diagramas da Seegson. (pausa curta) Primeiro, remova o cabo vermelho.",
PORTUGUESE(BRAZIL)_DIALOGUE.PCK,File3917-broken.wem,A1_M2102_RIP_1003,Dialogo,Normal,Medio.,,Certo – o vermelho primeiro.,
PORTUGUESE(BRAZIL)_DIALOGUE.PCK,File3801-broken.wem,A1_M2102_RIP_2315,Dialogo,Normal,Medio.,,Vermelho ok.,
PORTUGUESE(BRAZIL)_DIALOGUE.PCK,File5051.wem,A1_M2102_SAM_4098,Dialogo,Normal,Medio.,,"Agora, procure um cabo azul. Consegue ver?",
PORTUGUESE(BRAZIL)_DIALOGUE.PCK,File2251.wem,A1_M2102_RIP_9211,Dialogo,Normal,Medio.,,Achei. Azul desconectado. E agora?,
PORTUGUESE(BRAZIL)_DIALOGUE.PCK,File6067.wem,A1_M2102_SAM_2721,Dialogo,Normal,Medio.,,Estou com problemas para acessar os diagramas. O APOLLO está dificultando as coisas.,
PORTUGUESE(BRAZIL)_DIALOGUE.PCK,File1666-broken.wem,A1_M2102_RIP_7616,Dialogo,Normal,Medio.,,"Preciso do próximo, Samuels!",
PORTUGUESE(BRAZIL)_DIALOGUE.PCK,File4204-broken.wem,A1_M2102_RIP_4790,Fala instrospectiva,Normal,Medio.,,O quê?,
PORTUGUESE(BRAZIL)_DIALOGUE.PCK,File6241.wem,A1_M2102_SAM_7010,Dialogo,Normal,Medio.,,"O que está acontecendo aí, Ripley?",
PORTUGUESE(BRAZIL)_DIALOGUE.PCK,File6150-broken.wem,A1_M2102_RIP_3992,Dialogo,Normal,Medio.,,Acenderam as luzes de emergência! Não dá pra saber a cor dos cabos. Você vai ter que me guiar até eles!,
PORTUGUESE(BRAZIL)_DIALOGUE.PCK,File3000-broken.wem,A1_M2102_RIP_8097,Dialogo,Normal,Medio.,,Achei!,
PORTUGUESE(BRAZIL)_DIALOGUE.PCK,File4226-broken.wem,A1_M2102_SAM_9019,Dialogo,Normal,Medio.,,O próximo está ligado a uma tomada da parede. Tinha uma maca de cabeça para baixo perto dele.,
PORTUGUESE(BRAZIL)_DIALOGUE.PCK,File2893-broken.wem,A1_M2102_RIP_9528,Dialogo,Normal,Medio.,,"Achei, Samuels.",
PORTUGUESE(BRAZIL)_DIALOGUE.PCK,File3328-broken.wem,A1_M2102_SAM_6659,Dialogo,Normal,Medio.,,"Só mais dois, Ripley. Procure um painel de chão aberto. Deve ter um androide desativado do lado dele.",
PORTUGUESE(BRAZIL)_DIALOGUE.PCK,File5281.wem,A1_M2102_SAM_8271,Dialogo,Normal,Medio.,,"Só falta o último agora, Ripley.",
PORTUGUESE(BRAZIL)_DIALOGUE.PCK,File1949-broken.wem,A1_M2102_SGM_7896,Efeito sonoro,Normal,Medio.,,Alerta: Iniciando conexão com APOLLO,
PORTUGUESE(BRAZIL)_DIALOGUE.PCK,File5514.wem,A1_M2102_SGM_9224,Efeito sonoro,Normal,Medio.,,Alerta: Conexão não autorizada.,
PORTUGUESE(BRAZIL)_DIALOGUE.PCK,File5816.wem,A1_M2102_SGM_8096,Efeito sonoro,Normal,Medio.,,"Pessoal humano: saiam. Isto não é um treino.
25% da capacidade de sistema
50% da capacidade de sistema
Energia local além dos parâmetros de segurança.
75% da capacidade de sistema
Pessoal humano: saiam. Isto não é um treino.
100% da capacidade de sistema
Pessoal humano: saiam. Isto não é um treino.
110% da capacidade de sistema",
PORTUGUESE(BRAZIL)_DIALOGUE.PCK,File4290-broken.wem,A1_M2102_SGM_2439,Efeito sonoro,Normal,Medio.,,25% da capacidade de sistema,
PORTUGUESE(BRAZIL)_DIALOGUE.PCK,File3872.wem,A1_M2102_SGM_9584,Efeito sonoro,Normal,Medio.,,50% da capacidade de sistema,
PORTUGUESE(BRAZIL)_DIALOGUE.PCK,File1267.wem,A1_M2102_SGM_5205,Efeito sonoro,Normal,Medio.,,75% da capacidade de sistema,
PORTUGUESE(BRAZIL)_DIALOGUE.PCK,File1653.wem,A1_M2102_SGM_7116,Efeito sonoro,Normal,Medio.,,100% da capacidade de sistema,
PORTUGUESE(BRAZIL)_DIALOGUE.PCK,File0683.wem,A1_M2102_SGM_5250,Efeito sonoro,Normal,Medio.,,110% da capacidade de sistema. Excesso de energia.,
PORTUGUESE(BRAZIL)_DIALOGUE.PCK,File4491.wem,A1_M2102_SGM_2555,Efeito sonoro,Normal,Medio.,,Cinco minutos para a sobrecarga de energia,
PORTUGUESE(BRAZIL)_DIALOGUE.PCK,File5601-broken.wem,A1_M2102_SGM_8902,Efeito sonoro,Normal,Medio.,,Quatro minutos para a sobrecarga de energia,
PORTUGUESE(BRAZIL)_DIALOGUE.PCK,File4094.wem,A1_M2102_SGM_6356,Efeito sonoro,Normal,Medio.,,Três minutos para a sobrecarga de energia,
PORTUGUESE(BRAZIL)_DIALOGUE.PCK,File1159.wem,A1_M2102_SGM_3858,Efeito sonoro,Normal,Medio.,,Dois minutos e trinta segundos para a sobrecarga de energia.,
PORTUGUESE(BRAZIL)_DIALOGUE.PCK,File6066.wem,A1_M2102_SGM_3894,Efeito sonoro,Normal,Medio.,,Dois minutos para a sobrecarga de energia,
PORTUGUESE(BRAZIL)_DIALOGUE.PCK,File1883.wem,A1_M2102_SGM_8010,Efeito sonoro,Normal,Medio.,,Um minuto e trinta segundos para a sobrecarga de energia.,
PORTUGUESE(BRAZIL)_DIALOGUE.PCK,File3749.wem,A1_M2102_SGM_7176,Efeito sonoro,Normal,Medio.,,Trinta segundos para a sobrecarga de energia,
PORTUGUESE(BRAZIL)_DIALOGUE.PCK,File4846-broken.wem,A1_M2102_SGM_1577,Efeito sonoro,Normal,Medio.,,Dez,
PORTUGUESE(BRAZIL)_DIALOGUE.PCK,File6381.wem,A1_M2102_SGM_8368,Efeito sonoro,Normal,Medio.,,Nove,
PORTUGUESE(BRAZIL)_DIALOGUE.PCK,File0917-broken.wem,A1_M2102_SGM_3953,Efeito sonoro,Normal,Medio.,,Oito,
PORTUGUESE(BRAZIL)_DIALOGUE.PCK,File6443-broken.wem,A1_M2102_SGM_2509,Efeito sonoro,Normal,Medio.,,Sete,
PORTUGUESE(BRAZIL)_DIALOGUE.PCK,File1474.wem,A1_M2102_SGM_5341,Efeito sonoro,Normal,Medio.,,Seis,
PORTUGUESE(BRAZIL)_DIALOGUE.PCK,File5022-broken.wem,A1_M2102_SGM_3036,Efeito sonoro,Normal,Medio.,,Cinco,
PORTUGUESE(BRAZIL)_DIALOGUE.PCK,File3011-broken.wem,A1_M2102_SGM_4315,Efeito sonoro,Normal,Medio.,,Quatro,
PORTUGUESE(BRAZIL)_DIALOGUE.PCK,File1598.wem,A1_M2102_SGM_5573,Efeito sonoro,Normal,Medio.,,Três,
PORTUGUESE(BRAZIL)_DIALOGUE.PCK,File2224-broken.wem,A1_M2102_SGM_3946,Efeito sonoro,Normal,Medio.,,Dois,
PORTUGUESE(BRAZIL)_DIALOGUE.PCK,File6457-broken.wem,A1_M2102_SGM_4078,Efeito sonoro,Normal,Medio.,,Um,
PORTUGUESE(BRAZIL)_DIALOGUE.PCK,File1454.wem,A1_M2102_RIP_3826,Dialogo,Normal,Medio.,,Samuels. Você tá morrendo.,
PORTUGUESE(BRAZIL)_DIALOGUE.PCK,File1046.wem,A1_M2102_SAM_8508,Dialogo,Normal,Medio.,,Você fala como se eu tivesse uma vida de verdade. Eu... te agradeço por isso.,
PORTUGUESE(BRAZIL)_DIALOGUE.PCK,File0395-broken.wem,A1_M2102_RIP_9486,Dialogo,Normal,Baixo.,,Samuels.,
PORTUGUESE(BRAZIL)_DIALOGUE.PCK,File4622.wem,A1_M2102_SAM_5661,Dialogo,Normal,Medio.,,"O transporte do APOLLO está aberto. Assim que chegar ao núcleo, ele vai falar com você.",
PORTUGUESE(BRAZIL)_DIALOGUE.PCK,File2389.wem,A1_M2102_RIP_6020,Dialogo,Normal,Baixo.,,Você fez isso por mim?,
PORTUGUESE(BRAZIL)_DIALOGUE.PCK,File3907.wem,A1_M2102_SAM_2225,Dialogo,Normal,Medio.,,Eu queria que a Amanda Ripley tivesse as respostas...,
PORTUGUESE(BRAZIL)_DIALOGUE.PCK,File0155-broken.wem,A1_M2102_RIP_2887,Dialogo,Normal,Medio.,,Samuels morreu.,
PORTUGUESE(BRAZIL)_DIALOGUE.PCK,File3445.wem,A1_M2102_RIP_9261,Dialogo,Normal,Medio.,,Ele abriu o transporte do APOLLO pra mim e estou indo direto pra lá. Vou fazer o APOLLO suspender o confinamento.,
PORTUGUESE(BRAZIL)_DIALOGUE.PCK,File6473.wem,A1_M2102_RIC_1930,Walk Talk,Normal,Medio.,,Rip? Acabei de encontrar algo aqui. Uma fita de entrevistas. Você precisa ouvir isso.,
PORTUGUESE(BRAZIL)_DIALOGUE.PCK,File3132-broken.wem,A1_M2102_RIP_6012,Dialogo,Normal,Medio.,,"Coloque-a, Ricardo.",
PORTUGUESE(BRAZIL)_DIALOGUE.PCK,File2849.wem,A1_M2102_TAY_3651,Gravação de áudio,Normal,Medio.,,"Você é Marlow, certo?",
PORTUGUESE(BRAZIL)_DIALOGUE.PCK,File3789.wem,A1_M2102_MAR_5268,Gravação de áudio,Normal,Medio.,,Sim.,
PORTUGUESE(BRAZIL)_DIALOGUE.PCK,File6356-broken.wem,A1_M2102_TAY_7258,Gravação de áudio,Normal,Medio.,,Eu sou Taylor. Setor executivo da Weyland-Yutani.,
PORTUGUESE(BRAZIL)_DIALOGUE.PCK,File6265-broken.wem,A1_M2102_MAR_9457,Gravação de áudio,Normal,Medio.,,"Oh, os figurões agora, hein? Não é mais a garota abandonada?",
PORTUGUESE(BRAZIL)_DIALOGUE.PCK,File4812-broken.wem,A1_M2102_TAY_9289,Gravação de áudio,Normal,Medio.,,Deixe a Ripley fora disso. Ela só está buscando respostas. Já eu defendo os interesses da Weyland-Yutani.,
PORTUGUESE(BRAZIL)_DIALOGUE.PCK,File5726.wem,A1_M2102_MAR_5688,Gravação de áudio,Normal,Medio.,,E eu estou tentando sair dessa maldita cela. Talvez possamos fazer um acordo?,
PORTUGUESE(BRAZIL)_DIALOGUE.PCK,File0678-broken.wem,A1_M2102_TAY_1243,Gravação de áudio,Normal,Medio.,,"Talvez. Isso está sendo gravado, entendeu?",
PORTUGUESE(BRAZIL)_DIALOGUE.PCK,File6451.wem,A1_M2102_MAR_8008,Gravação de áudio,Normal,Medio.,,Eu vi. A luz vermelha está acesa.,
PORTUGUESE(BRAZIL)_DIALOGUE.PCK,File3482.wem,A1_M2102_TAY_2363,Gravação de áudio,Normal,Medio.,,Eu quero dados. O local do planetoide onde você encontrou a nave abandonada. Todos os dados que tiver sobre a origem daquele organismo.,
PORTUGUESE(BRAZIL)_DIALOGUE.PCK,File5227.wem,A1_M2102_MAR_8538,Gravação de áudio,Normal,Medio.,,Eu posso te dar isso. E uma saída dessa estação. Você só tem que me tirar daqui.,
PORTUGUESE(BRAZIL)_DIALOGUE.PCK,File3534-broken.wem,A1_M2102_TAY_3725,Gravação de áudio,Normal,Medio.,,Creio que posso aceitar esses termos.,
PORTUGUESE(BRAZIL)_DIALOGUE.PCK,File0031.wem,A1_M2102_TAY_5036,Gravação de áudio,Normal,Medio.,,Mas que merda?,
PORTUGUESE(BRAZIL)_DIALOGUE.PCK,File3397.wem,A1_M2102_MAR_6394,Gravação de áudio,Normal,Medio.,,"Taylor! Taylor, me tire dessa cela! Agora! Me tire daqui!",
PORTUGUESE(BRAZIL)_DIALOGUE.PCK,File4512-broken.wem,A1_M2102_RIC_8886,Walk Talk,Normal,Medio.,,Ripley?,
PORTUGUESE(BRAZIL)_DIALOGUE.PCK,File3497-broken.wem,A1_M2102_RIP_5692,Dialogo,Normal,Medio.,,Eu ouvi.,
PORTUGUESE(BRAZIL)_DIALOGUE.PCK,File3017.wem,A1_M2201_RIC_9412,Walk Talk,Normal,Medio.,,Você está no andar acima do Núcleo do APOLLO. Toda essa área contém os sistemas de apoio do APOLLO com o próprio Núcleo de Inteligência Artificial ao centro.,
PORTUGUESE(BRAZIL)_DIALOGUE.PCK,File2055-broken.wem,A1_M2201_RIC_5725,Walk Talk,Normal,Medio.,,"O APOLLO impediu Samuels de suspender o confinamento remotamente, mas ele garantiu que assim que você entrar, o APOLLO ao menos falará com você.",
PORTUGUESE(BRAZIL)_DIALOGUE.PCK,File1295-broken.wem,AI_UI_SPE_1879,Gravação de áudio,Normal,Medio.,,"Eu vim até o APOLLO a fim de descobrir o que enlouqueceu os sintéticos. Este lugar virou um inferno. O APOLLO redirecionou as tarefas primárias dos androides e eles deixaram a manutenção que pedimos após recebermos a notícia. Tem líquido de refrigeração para todo lado, houve vazamento de gás e o elevador de acesso primário foi desligado. Eu registrei uma solicitação de ajuda, mas parece que meu número na fila é quarenta e cinco. Do nada, os sistemas ficaram obcecados com a Contenção de Risco. Vou achar um jeito de descer. Spedding desligando.",
PORTUGUESE(BRAZIL)_DIALOGUE.PCK,File2252-broken.wem,A1_M2201_SGM_0610,Efeito sonoro,Normal,Medio.,,Armas de fogo detectadas.,
PORTUGUESE(BRAZIL)_DIALOGUE.PCK,File1089.wem,A1_M2201_RIP_0620,Fala instrospectiva,Normal,Baixo.,,Você tá brincando comigo.,
PORTUGUESE(BRAZIL)_DIALOGUE.PCK,File2196-broken.wem,A1_M2201_SGM_0020,Efeito sonoro,Normal,Medio.,,Coloque as armas de fogo no transportador de segurança.,
PORTUGUESE(BRAZIL)_DIALOGUE.PCK,File0034-broken.wem,A1_M2201_SGM_0630,Efeito sonoro,Normal,Medio.,,A Seegson e APOLLO agradecem.,
PORTUGUESE(BRAZIL)_DIALOGUE.PCK,File3765.wem,A1_M2201_RIP_0640,Fala instrospectiva,Normal,Baixo.,,Aposto que sim.,
PORTUGUESE(BRAZIL)_DIALOGUE.PCK,File5508.wem,A1_M2201_SGM_3136,Efeito sonoro,Normal,Medio.,,Elevador de acesso ao Núcleo do APOLLO offline.,
PORTUGUESE(BRAZIL)_DIALOGUE.PCK,File2495-broken.wem,A1_M2201_SGM_4987,Efeito sonoro,Normal,Medio.,,Sistemas primários de APOLLO inacessíveis.,
PORTUGUESE(BRAZIL)_DIALOGUE.PCK,File4648-broken.wem,A1_M2201_RIP_8478,Dialogo,Normal,Medio.,,"Ricardo, a entrada tá bloqueada.",
PORTUGUESE(BRAZIL)_DIALOGUE.PCK,File3723.wem,A1_M2201_RIC_0110,Walk Talk,Normal,Medio.,,O diagrama que usaram no tour de vendas da Sevastopol deve estar por perto. Veja se tem uma porta nos fundos.,
PORTUGUESE(BRAZIL)_DIALOGUE.PCK,File2082-broken.wem,A1_M2201_RIP_5474,Dialogo,Normal,Baixo.,,"Certo, vejamos... tem um cabo de energia que se liga ao núcleo do APOLLO. Posso usar isso.",
PORTUGUESE(BRAZIL)_DIALOGUE.PCK,File0662-broken.wem,A1_M2201_RIC_9520,Walk Talk,Normal,Medio.,,Acha que vai encaixar?,
PORTUGUESE(BRAZIL)_DIALOGUE.PCK,File5941.wem,A1_M2201_RIP_9218,Dialogo,Normal,Baixo.,,"Desligue a eletricidade, respire fundo, esprema... Fácil...",
PORTUGUESE(BRAZIL)_DIALOGUE.PCK,File5467-broken.wem,A1_M2201_RIC_7801,Walk Talk,Normal,Medio.,,Eu não vou subir aí pra soltar você se ficar presa.,
PORTUGUESE(BRAZIL)_DIALOGUE.PCK,File0245.wem,A1_M2201_RIC_2858,Walk Talk,Normal,Medio.,,"Se aconchegar com um cabo de energia ativo vai doer, né?",
PORTUGUESE(BRAZIL)_DIALOGUE.PCK,File3529.wem,A1_M2201_RIP_4718,Dialogo,Normal,Baixo.,,Tenho que desligar a força primeiro.,
PORTUGUESE(BRAZIL)_DIALOGUE.PCK,File0710-broken.wem,AI_UI_CHI_0010,Gravação de áudio,Normal,Medio.,,"Ei, é o Chefe. Tem algo errado com os seus sintéticos. A equipe que eu pedi para desmontar os ativos na habitação inferior simplesmente parou. Falaram algo sobre uma ordem de Contenção de Risco, tentaram entrar na minha cabine de controle e depois foram embora. Sei que eu sempre reclamo desses carecas assustadores, mas desta vez tenho provas de que estão com defeito. Tenho uma reunião com o seu chefe Spedding amanhã e vou mandar bronca. E quando a bronca chegar a você... bem, lembre-se que está vindo de mim.",
PORTUGUESE(BRAZIL)_DIALOGUE.PCK,File1769-broken.wem,A1_M2201_RIP_6799,Dialogo,Normal,Medio.,,Ricardo? O cabo de energia já tá desligado.,
PORTUGUESE(BRAZIL)_DIALOGUE.PCK,File3927.wem,A1_M2201_RIC_5605,Walk Talk,Normal,Medio.,,Eu consegui os diagramas do APOLLO aqui. Parece que você pode chegar ao acesso pelo eixo da turbina,
PORTUGUESE(BRAZIL)_DIALOGUE.PCK,File3499-broken.wem,A1_M2201_RIC_9932,Walk Talk,Normal,Medio.,,Deve ter um desligamento de emergência perto daí. Mas não vai ficar desligada pra sempre. Você vai ter que entrar rápido.,
PORTUGUESE(BRAZIL)_DIALOGUE.PCK,File0635-broken.wem,A1_M2201_SGM_5678,Efeito sonoro,Normal,Medio.,,"Alerta. Ventilação da turbina desligada. Para evitar o derretimento do servidor, os procedimentos de reinício de segurança serão inicializados.",
PORTUGUESE(BRAZIL)_DIALOGUE.PCK,File4346-broken.wem,A1_M2201_RIP_5742,Dialogo,Normal,Baixo.,,A turbina desligou. O caminho deve estar livre.,
PORTUGUESE(BRAZIL)_DIALOGUE.PCK,File0358.wem,A1_M2201_RIC_2037,Dialogo,Normal,Medio.,,"Melhor correr. Se os sistemas do APOLLO superaquecerem, eles vão reiniciar.",
PORTUGUESE(BRAZIL)_DIALOGUE.PCK,File3823-broken.wem,A1_M2201_SGM_2428,Efeito sonoro,Normal,Medio.,,Obstrução livre. Inicializando turbina.,
PORTUGUESE(BRAZIL)_DIALOGUE.PCK,File5235.wem,A1_M2201_RIP_0370,Dialogo,Normal,Medio.,,Isso vai ser apertado.,
PORTUGUESE(BRAZIL)_DIALOGUE.PCK,File4538-broken.wem,A1_M2201_RIC_0380,Walk Talk,Normal,Medio.,,Boa sorte.,
PORTUGUESE(BRAZIL)_DIALOGUE.PCK,File5080.wem,A1_M2201_RIC_5179,Walk Talk,Normal,Medio.,,"Ripley, você tá avançando dentro do APOLLO e o sinal do seu rádio tá começando a falhar. Logo vou perder você.",
PORTUGUESE(BRAZIL)_DIALOGUE.PCK,File3395.wem,A1_M2201_RIP_5856,Dialogo,Normal,Baixo.,,"Ótimo. Cruze os dedos por mim, hein?",
